{
  "schemaVersion": 1,
  "productVersion": "0.1.0",
  "target": "x86_64-pc-windows-msvc",
  "components": [
    {
      "id": "api",
      "version": "0.1.0",
      "path": "api/voyage-vii-api.exe",
      "sha256": "aaaaaaaaaaaaaaaaaaaaaaaaaaaaaaaaaaaaaaaaaaaaaaaaaaaaaaaaaaaaaaaa",
      "licensePath": null,
      "source": {
        "kind": "first-party-build",
        "url": null,
        "revision": "0123456789abcdef0123456789abcdef01234567"
      }
    },
    {
      "id": "postgresql",
      "version": "18.4",
      "path": "postgresql/bin/postgres.exe",
      "sha256": "bbbbbbbbbbbbbbbbbbbbbbbbbbbbbbbbbbbbbbbbbbbbbbbbbbbbbbbbbbbbbbbb",
      "licensePath": "licenses/postgresql/COPYRIGHT",
      "source": {
        "kind": "official-source",
        "url": "https://ftp.postgresql.org/pub/source/v18.4/postgresql-18.4.tar.bz2",
        "revision": "18.4"
      }
    },
    {
      "id": "tigerbeetle",
      "version": "0.17.7",
      "path": "tigerbeetle/tigerbeetle.exe",
      "sha256": "cccccccccccccccccccccccccccccccccccccccccccccccccccccccccccccccc",
      "licensePath": "licenses/tigerbeetle/LICENSE",
      "source": {
        "kind": "official-release",
        "url": "https://github.com/tigerbeetle/tigerbeetle/releases/download/0.17.7/tigerbeetle-x86_64-windows.zip",
        "revision": "0.17.7"
      }
    }
  ]
}
